date,title,company,link,content,관련성,키워드,summary,검색어,importance
2026-05-05,"""지금도 늦지 않았다?""…사상 최고가 뚫은 SK하이닉스, 목표주가는[클릭 e종목]",정보 없음,https://n.news.naver.com/mnews/article/277/0005758422,"미래에셋증권은 사상 최고가를 경신한 SK하이닉스에 대해 전방 업황이 밝다면서 '목표주가 200만원'을 유지했다. 글로벌 빅테크들을 중심으로 설비투자(CAPEX) 규모가 지속적으로 확대되는 등 수요 강세가 재확인되고 있다는 이유에서다.연합뉴스5일 미래에셋증권에 따르면 김영건 연구원은 전날 공개된 보고서에서 ""기존 2027년 연간 평균판매가격(ASP) 추정치를 일부 하향했으나 12개월 기준 예상 주당순자산(BPS)에 미치는 영향은 제한적이라 목표가에는 변함이 없다""며 이같이 밝혔다. 투자의견 역시 '매수'를 유지했다.먼저 김 연구원은  ""빅테크 모두 인공지능(AI) 사업의 급성장 성과를 구체적 수치로 공유하고 있다""면서 ""대규모 수주 잔고로 판단컨대 CAPEX 투자가 급하락 전환할 가능성은 낮아 보인다""고 분석했다.지난주 북미 빅테크 실적 발표 이후 글로벌 하이퍼스케일러의 2026년 CAPEX 총액은 8060억달러로 집계됐다. 이는 전년 대비 73% 상향된 규모다. 2027년에도 이들 기업의 CAPEX 투자는 확대될 것으로 전망됐다.여기에 빅테크 ASIC향 고대역폭메모리(HBM) 수요도 긍정적으로 평가됐다. 김 연구원은 ""추론형 CPU(중앙처리장치) 강세도 포착된다""며 ""CPU에는 컨벤셔널 메모리 수요가 동반된다""고 주목했다. 또한 ""업계의 장기공급 계약 동향도 고무적이다. 경쟁사인 샌디스크는 최대 5년간의 장기 공급계약을 체결했음을 밝혔다""면서 ""업계 전반에 걸친 계약 기조일 것""이라고 예상했다.미래에셋증권이 제시한 올해와 내년 연간 영업이익 전망치는 각각 279조원, 398조원이다. 이는 전년 대비 491%, 43% 증가한 규모다.한편 SK하이닉스는 4일 국내 증시에서 전장 대비 12.52% 상승한 144만7000원에 정규장을 마감했다. 장중 145만원을 돌파해 역대 최고가를 경신한 데 이어, 종가 기준으로도 사상 최고치를 갈아치웠다. 시가총액 역시 처음으로 1000조원을 돌파했다.",True,SK하이닉스,"미래에셋증권은 SK하이닉스의 업황이 밝다며 목표주가 200만원을 유지했고, 빅테크의 설비투자 확대와 AI 수요 증가로 수요 강세가 지속될 것으로 전망했다. SK하이닉스는 사상 최고가를 기록하며 시가총액 1000조원을 돌파했다.",SK하이닉스,2.0
2026-05-04,SK하이닉스 시총 1000조 돌파… 코스피 4% 급등,정보 없음,https://n.news.naver.com/mnews/article/081/0003640827,"4일 서울 중구 하나은행 딜링룸 현황판에 코스피가 표시되고 있다. 이날 코스피는 전장 대비 184.06포인트(2.79%) 오른 6782.93에, 코스닥 지수는 19.93포인트(1.67%) 오른 1212.28에 개장했다. 2026.5.4 뉴스1코스피가 4일 장중 6800선을 넘어서며 사상 최고치를 경신하고 있다.한국거래소에 따르면 이날 오전 11시 39분 현재 코스피는 전장 대비 269.44포인트(4.08%) 오른 6863.31을 가리키고 있다.코스피는 이날 2.79% 오른 6782.93으로 출발해 6800선을 터치한 후 등락을 이어가다 오름폭을 늘려 6850선을 웃돌고 있다.이날 코스피에선 SK하이닉스의 질주가 두드러진다.SK하이닉스는 같은 시각 전장보다 12만 9000원(10.03%) 급등한 141만 5000원에 거래되고 있다. 시가총액은 1000조원을 돌파했다. 삼성전자에 이은 역대 두 번째 기록이다.SK하이닉스는 인공지능(AI) 인프라 확산에 따른 고대역폭메모리(HBM) 등 고성능 메모리 공급을 확대하면서 올해 1분기 사상 최대인 37조 6103억원의 영업이익을 기록했다. 영업이익률은 71.5%에 달했다.삼성전자도 4%대 상승률을 기록하고 있다.",True,SK하이닉스,"4일 코스피가 6800선을 넘으며 사상 최고치를 경신했고, SK하이닉스는 10% 이상 급등하며 시가총액 1000조원 돌파, 인공지능 수요 증가로 고성능 메모리 공급 확대가 주효했다.",SK하이닉스,3.0
2026-05-04,"SK하이닉스, 장중 시총 1000조 돌파…'140만닉스' 굳힐까",정보 없음,https://n.news.naver.com/mnews/article/629/0000496543,"장중 144만4000원까지 '껑충'…사상 최고가 경신4일 장중 SK하이닉스는 140만원선을 넘어섰다. /더팩트 DB[더팩트｜윤정원 기자] SK하이닉스가 4일 장중 10% 넘게 급등하며 사상 처음으로 140만원선을 넘어섰다. 인공지능(AI) 반도체 수요 확대 기대감에 외국인과 기관 매수세가 몰리면서 시가총액도 장중 1000조원을 돌파했다.한국거래소에 따르면 이날 오후 1시 58분 기준 SK하이닉스는 전 거래일(128만6000원) 대비 10.81%(13만9000원) 상승한 142만5000원을 호가하고 있다. 이날 133만9000원으로 개장한 SK하이닉스는 장중 144만4000원까지도 뛰며 사상 최고가를 다시 썼다. 지난달 28일 기록한 장중 최고가 132만8000원을 불과 3거래일 만에 갈아치운 셈이다. 시총도 1014조8882억원에 이른다.주가 급등은 국내 증시 휴장 기간 누적된 미국 기술주 강세가 한꺼번에 반영된 결과로 풀이된다. 국내 증시가 노동절 연휴로 지난 1일 휴장한 사이 뉴욕증시에서는 반도체주 중심의 상승세가 이어졌다. 필라델피아 반도체 지수는 지난달 30일과 이달 1일 각각 2.26%, 0.87% 올랐다. SK하이닉스와 함께 삼성전자도 강세를 보이며 전기·전자 업종 전반으로 매수세가 확산됐다.증권가에서는 SK하이닉스의 서버용 D램 가격 상승과 고대역폭메모리(HBM) 경쟁력이 주가 재평가를 이끌고 있다는 분석이 나온다. 이종욱 삼성증권 연구원은 ""실적 서프라이즈의 핵심은 서버 D램을 중심으로 한 가격 상승 강도가 예상보다 높았기 때문""이라며 ""인공지능(AI) 인프라 투자는 전략적 선택의 영역이고 성능 확보와 시장 선점이 핵심""이라고 분석했다. 삼성증권은 SK하이닉스의 목표주가를 기존 130만원에서 180만원으로 올리고 투자의견 '매수'를 유지했다.실적 개선세도 주가 상승을 뒷받침하고 있다. SK하이닉스는 올해 1분기 연결 기준 매출 52조5763억원, 영업이익 37조6103억원을 기록했다. 전년 동기 대비 매출은 198.1%, 영업이익은 405.5% 증가했다. 매출과 영업이익 모두 분기 기준 최대 기록이다.다만 높아진 실적 기대치를 감안하면 주가 상승 여력을 보수적으로 봐야 한다는 의견도 있다. 이민희 BNK투자증권 연구원은 ""SK하이닉스는 높아진 기대 수준보다는 올해 1분기 실적이 미흡했다""며 ""최근 마이크론, 삼성전자 실적 발표 이후 40조원 이상의 영업이익을 기대하던 분위기와 비교하면 눈높이를 맞추지 못했다""고 평가했다.발로 뛰는 더팩트는 24시간 여러분의 제보를 기다립니다.▶카카오톡: '더팩트제보' 검색▶이메일: jebo@tf.co.kr▶뉴스 홈페이지: http://talk.tf.co.kr/bbs/report/write",True,SK하이닉스,"SK하이닉스가 인공지능 반도체 기대와 미국 기술주 강세에 힘입어 4일 장중 144만4000원까지 치솟으며 사상 최고가를 기록했고, 시가총액도 1014조원을 돌파했다. 실적 호조와 서버용 D램 가격 상승이 주가 상승을 견인했으며, 전문가들은 목표주가를 높게 평가하고 있다.",SK하이닉스,2.0
2026-05-04,"외국인, 하이닉스 ADR상장 앞두고 쓸어담아 … '1000조닉스' 등극",정보 없음,https://n.news.naver.com/mnews/article/009/0005675302,"SK하이닉스 주가 파죽지세외국인 1.7조 매수 주가 12%↑연초 시총 500조→1천조 돌파PER 4.3배 … 상승 여력 여전美메모리ETF 한달새 4조 몰려빅테크社 메모리 수요도 탄탄AI 수혜 전력 인프라株에 집중LS일렉트릭·산일전기 등 올라2023년 영업적자 7조7303억원에, 주가가 7만원대에 머물던 SK하이닉스는 불과 3년 만에 연간 영업이익 250조원(증권가 컨센서스), 주가 140만원대의 전혀 다른 기업으로 환골탈태했다.2024년 고대역폭메모리(HBM) 관련 실적 호조로 흑자 전환에 성공한 이후 지난해에는 D램 시장 점유율 1위에 오르며 주가와 실적 모두에서 쾌속 질주를 이어가는 모습이다.SK하이닉스 주가는 지난해 5월 14일 20만원을 처음 돌파한 이후 1년도 안 된 4일 144만7000원을 기록했다. 인공지능(AI) 데이터센터 설립 붐이 이끄는 반도체 슈퍼사이클의 수혜는 삼성전자에 쏠리는 듯했지만 AI 반도체 관련 투자처를 찾는 외국인들의 '톱픽(Top Pick)'은 단연 SK하이닉스였다. 여러 사업부로 구성된 삼성전자와 달리 SK하이닉스는 반도체 사업만 주력으로 하고 있고 연내 미국예탁증서(ADR) 상장도 앞두고 있어 주가 상승이 훨씬 가팔랐다는 분석이다.◆ ADR 앞두고 외인 매수세 몰려SK하이닉스가 4일 하루 만에 '120만닉스'에서 '140만닉스'로 도약할 수 있었던 원동력도 단연 외국인 순매수였다. 외국인은 이날 SK하이닉스와 삼성전자(우선주 포함) 주식을 각각 1조7000억원, 1조3600억원 규모 순매수했다. ADR을 앞두고 미국 증시에서 높은 가격을 받기 전 선점하겠다는 수요가 몰린 것이다. ADR은 외국 기업이 미국 증시에서 자기 회사 주식을 거래할 수 있도록 발행하는 증권으로 글로벌 투자 접근성을 높이는 측면이 있다. 대만 파운드리 기업 TSMC 사례처럼 미국 증시의 높은 밸류에이션을 적용받을 수 있는 효과까지 기대할 수 있다.현재 SK하이닉스의 12개월 선행 주가수익비율(PER)은 4.3배로 글로벌 반도체 업계 최저 수준이다. 메모리 산업 특성상 이익 변동성이 크고 코리아 디스카운트가 일부 작용해 낮은 밸류에이션을 받고 있는데 ADR 상장으로 저평가가 해소될 수 있을 것이란 기대가 나온다. 같은 메모리 회사임에도 불구하고 마이크론은 5.4배를 적용받고 있기 때문이다.◆ 美 상장 K메모리 ETF 열풍여기에 미국 온라인 1위 증권사 인터랙티브브로커스(IBKR)가 이달부터 외국인 통합계좌 기반 한국 주식 중개 서비스를 시작하면서 첫 거래일인 이날 리테일 투자자들이 몰린 측면도 있다. 그간 미국 개인투자자들이 한국 증시에 투자하기 위해서는 상장지수펀드(ETF)를 통한 간접투자밖에 방법이 없었는데 개별주 직접 매수가 가능해진 것이다. 외국인들의 매수 화력은 삼성전자와 SK하이닉스에 집중됐다.지난달 1일 미국 증시에 처음으로 상장된 메모리 ETF인 'DRAM'은 한 달도 안 돼 운용 규모가 26억달러(약 3조8000억원)까지 올라가며 한국 반도체주 상승을 이끌고 있다. 메모리 회사들에 집중 투자하는 이 ETF에서 SK하이닉스가 차지하는 비중은 26%에 달한다.시가총액이 1000조원이 넘는 초대형 종목이 하루에 12%씩 상승한 데는 숏커버링(빌린 주식을 다시 매수)도 한몫했다. 여기에 지난달 28일 기준 공매도 순보유 잔액이 6821억원 정도로 쌓여 있는 상황에서 외국인들의 매수가 주가를 끌어올리자 강한 숏커버링이 나왔다.◆ 빅테크 투자 확대 기대감도이런 가운데 지난주 실적발표에 나선 미국 빅테크들이 자본지출(CAPEX) 확대 메시지를 내면서 여전히 탄탄한 반도체 수요가 확인됐다. 김영건 미래에셋증권 연구원은 ""글로벌 하이퍼스케일러의 올해 CAPEX 총액은 지난해보다 73% 늘어난 8060억달러로 올라갔고 대규모 수주 잔액으로 볼 때 CAPEX 투자가 하락 전환될 가능성은 낮아 보인다""고 말했다.여기에 지난 1일 수출입 동향까지 발표되면서 예상보다 견고한 반도체 수출이 2분기 실적 기대까지 키웠다. 반도체 수출은 전년 동기 대비 174% 상승한 319억달러를 기록했다.이 때문에 증권사들도 목표 주가를 상향하는 추세다. 유진투자증권이 230만원을 제시한 것을 비롯해 미래에셋증권은 200만원, 한국투자증권은 205만원을 제시했다.다만 수급 요인으로 주가에 가속도가 붙은 것과 별개로 향후 이익 성장률은 둔화될 것이라고 보는 시각도 있다. 이민희 BNK투자증권 연구원은 ""작년부터 시작된 추론 AI 사이클이 후반부에 접어들었다는 점과 상대적으로 수익성이 낮은 HBM4 매출 비중 확대 영향으로 평균판매단가(ASP) 증가율은 둔화될 것으로 보인다""며 지난주에 투자의견을 '보유'로 하향 조정했다.한편 빅테크들의 CAPEX 확대 기대감에 힘입어 이날 전력 인프라주도 강세를 이어갔다. 이날 LS일렉트릭이 5.76% 오른 것을 비롯해 HD현대일렉트릭이 3.75%, 산일전기는 25.38% 올랐다. 다만 이날 코스피 상승이 AI 밸류체인 관련 종목들에 집중되면서 하락 종목 수(476개)가 상승 종목 수(392개)보다 많았다.[김제림 기자]",True,SK하이닉스,"SK하이닉스는 외국인 투자와 미국 증시 ADR 상장 기대, 메모리 ETF 유입으로 급등하며 시가총액 1천조 돌파. 지난해 대비 주가와 실적이 크게 성장했고, AI·반도체 수요가 지속되고 있다. 그러나 이익 성장 둔화 우려도 존재한다.",SK하이닉스,3.0
2026-05-04,코스피 7000까지 63p 남아…144만 원 돌파한 SK하이닉스 '시총 1천조',정보 없음,https://n.news.naver.com/mnews/article/057/0001947597,"【 앵커멘트 】코스피가 오늘 하루만 5.1%, 무려 338포인트나 올랐습니다.꿈의 7천까지 단 63포인트 남았는데요.대형 반도체주가 오늘도 훨훨 날아 SK하이닉스는 시가총액이 1천조 원을 돌파했습니다.장동건 기자입니다.【 기자 】장 시작과 함께 6700선으로 뛰어오른 코스피.이후엔 더 거침이 없었습니다.꾸준히 상승세를 키우더니 6936.99에 장을 마쳤습니다.5.1%, 하루 만에 338포인트나 뛴 겁니다.7000까지 단 63포인트 남겨뒀습니다.▶ 스탠딩 : 장동건 / 기자- ""코스피는 올해 들어 두 달간 2천 포인트가량 올랐다가 전쟁 발발 이후 뚝 떨어져 3월 말에는 5천 선까지 내려앉았습니다.하지만, 한 달여 만에 다시 2천 포인트가량 급등했습니다.""개인이 4조 8천억 원 가까이 팔며 차익 실현에 나섰지만, 외국인과 기관이 4조 9천억 원 넘게 사들여 지수를 끌어올렸습니다.특히, 외국인 매수세가 집중된 SK하이닉스는 12% 넘게 뛰어 144만 7000원으로 새 기록을 썼습니다.시가총액 역시 삼성전자에 이어 두 번째로 1천조 원을 돌파했습니다.모회사인 SK스퀘어도 주가가 17% 넘게 폭등했고,삼성전자는 5% 넘게 오르며 직전 최고가인 23만 원을 넘어 신고가로 마감했습니다.노동절로 국내 증시가 쉬는 사이 뉴욕 증시에서 기술주들이 강세를 이어간 게 한꺼번에 우리 증시에 반영된 데다,어린이날 휴장을 앞두고 매수세가 먼저 유입된 측면이 있다는 분석입니다.▶ 인터뷰 : 김두언 / 하나증권 연구원- ""반도체 실적에 대한 가시성이 (2분기를 넘어) 하반기에도 이어질 거라는 기대감…삼성전자에 대한 노조 이슈로 다소 자유로웠던 게 SK하이닉스다.""외국인 투자자들의 국내 주식 대규모 매수에 힘입어 원·달러 환율은 20원 넘게 하락해 모처럼 1462원으로 주간 거래를 마쳤습니다.MBN뉴스 장동건입니다.영상취재 : 박양배 기자영상편집 : 이주호그 래 픽 : 백미희",True,SK하이닉스,"코스피가 하루 만에 5.1% 상승하며 6936.99를 기록했고, SK하이닉스는 시가총액 1천조 원을 돌파하며 144만7000원에 거래됐습니다. 외국인과 기관의 매수세로 증시가 크게 올랐으며, 환율도 하락했습니다.",SK하이닉스,3.0
2026-05-05,하이닉스 주가 두 자릿수 급등인데…삼성전자는 '노조 변수'에 발목,정보 없음,https://n.news.naver.com/mnews/article/003/0013925781,"23일 이후 삼전 4.27% 상승…SK하닉은 18.7% 급등씨티그룹, 목표가 하향…""성과급 충당금에 실적 우려""""메모리 슈퍼사이클에 상승 추세 문제 없다"" 분석도[서울=뉴시스] 전신 기자 = 코스피가 전 거래일(6598.87)보다 338.12포인트(5.12%) 오른 6936.99에 마감한 4일 서울  중구 하나은행 딜링룸 전광판에 코스피 등이 표시돼 있다.삼성전자는 전장 대비 5.44% 상승한 23만2500원에, SK하이닉스는 전장 대비 12.52% 오른 144만7000원에 거래를 마쳤다. 2026.05.04. photo1006@newsis.com[서울=뉴시스]이지민 기자 = 인공지능(AI) 투자 사이클 속 '반도체 랠리'가 지속되는 가운데 최근 삼성전자의 주가 상승률이 SK하이닉스 대비 부진한 모습이다. '노조 변수'에 따른 불확실성 우려가 작용하고 있다는 분석이다.5일 한국거래소에 따르면 전날 SK하이닉스 주가는 전 거래일 대비 12.52% 급등했다. 시가총액은 처음으로 1000조원을 돌파했고, 128만원을 기록하던 주가는 단숨에 140만원 선에 안착했다.같은 날 삼성전자도 5.44% 급등했지만, SK하이닉스에 비하면 상승률이 부진하다는 지적이다.최근 삼성전자 내 성과급을 둘러싼 노사 갈등이 격화된 영향으로 풀이된다.실제 삼성전자 노조가 총파업 예고한 지난 23일 이후 주가 추이를 보면 SK하이닉스는 18.7% 상승한 데 비해 삼성전자 주가 상승률은 4.27%에 그쳤다.최근 글로벌 투자은행(IB) 씨티그룹은 삼성전자의 목표주가를 기존 32만원에서 30만원으로 하향 조정하며, 노사 갈등을 최대 리스크로 꼽았다. 파업이 격화할 경우 대규모 성과급 충당금 설정이 불가피하다는 것이다.피터 리 애널리스트는 ""삼성전자를 메모리 시장 성장의 장기적 수혜자로 보지만, 노동 파업이 심화하는 가운데 성과급 관련 충당금으로 인한 실적 하방 리스크를 우려한다""고 말했다.그는 ""회사가 아직 올해 1분기에 성과급 관련 충당금을 반영하지 않았기에 향후 발표될 올해와 내년 영업이익 추정치에 영향을 미칠 것으로 예상한다""며 ""올해와 내년 영업이익 추정치를 각각 10%와 11% 하향 조정한다""고 설명했다.다만, 구조적 성장 고려하면 주가 상승 추세 유지할 것이라는 게 국내 증권가의 대체적 시각이다.다올투자증권은 전날 삼성전자 목표주가를 기존 35만원에서 39만원까지 올려 잡았다. 국내 증권가 기준 가장 높은 목표치다.고영민 다올투자증권 연구원은 ""단기적으로 파업 및 임직원 보상 규모 미정 등 주가의 불확실성 요인이 존재한다""면서도 ""아직 끝나지 않은 평균판매가격(ASP) 상승과 이익 추정치 상향, 실적 대비 눌려있는 주가 수준을 감안하면 오히려 적극 비중확대 기회로 활용할 구간""이라고 말했다.손인준 유진투자증권 연구원은 ""최근 삼성전자는 노조 파업 우려로 인해 경쟁사 대비 부진한 주가 움직임을 보였다""며 ""관련 불확실성은 협상 타결 이전까지 지속되겠으나, 메모리 슈퍼사이클과 이에 기반한 사업부 연계 전략으로 나타날 구조적 성장을 고려하면 주가의 상승 추세가 유지될 것""으로 전망했다. 목표주가는 36만원을 제시했다.한편, SK하이닉스 역시 일각의 고점 우려 제기에도 불구하고 증권가의 눈높이는 지속 상향되고 있다.김영건 미래에셋증권 연구원은 SK하이닉스 목표주가를 200만원으로 제시하며 ""지난주 북미 빅테크 실적발표 이후 글로벌 하이퍼스케일러의 올해 설비투자(Capex) 총액이 전년 대비 73%로 상향됐고, 내년에도 Capex 투자가 확대될 전망""이라고 짚었다．",True,삼성전자,"코스피가 5.12% 상승하며 6936.99에 마감했고, 삼성전자는 5.44% 오른 23만2500원, SK하이닉스는 12.52% 상승해 시가총액 1000조원 돌파. 삼성전자는 노조 파업 우려와 성과급 충당금 부담으로 실적 우려가 있지만, 증권가들은 구조적 성장 기대와 목표주가 상향을 유지하고 있다.",SK하이닉스,2.0
