date,title,company,link,content,관련성,키워드,summary,검색어,importance
2026-05-02,"[뉴욕증시] 반도체 강세 속 이틀 연속 사상 최고…애플, 3.2% 급등",정보 없음,https://n.news.naver.com/mnews/article/014/0005516324,"[파이낸셜뉴스]뉴욕 증시의 스탠더드앤드푸어스(S&P)500과 나스닥 지수가 1일(현지시간) 반도체 강세 속에 이틀 연속 사상 최고 기록을 경신했다. AP 뉴시스뉴욕 증시의 스탠더드앤드푸어스(S&P)500과 나스닥 지수가 1일(현지시간) 사상 최고 기록을 다시 썼다. 이틀 연속 사상 최고치를 경신했다.반면 다우존스산업평균은 전날 급등세를 접고 하루 만에 약세로 방향을 틀었다.애플은 전날 장 마감 뒤 깜짝 실적에 힘입어 3.2% 급등했다.반도체 종목들이 상승 흐름을 주도했다.인텔과 마이크론이 각각 5.5%, 4.9% 급등했고, AMD도 1.7% 상승했다.반면 엔비디아는 0.6% 내리며 하락세를 지속했다.사상 최고S&P500은 전장 대비 21.11p(0.29%) 오른 7230.12, 나스닥은 222.13p(0.89%) 상승한 2만5114.44로 마감했다.S&P500과 나스닥은 지난달 15일 사상 최고 행진을 재개했다. S&P500은 1월 27일 이후 약 석 달 만에, 나스닥은 지난해 10월 29일 이후 약 5개월 만에 사상 최고치를 경신한 뒤 강세를 지속하고 있다.반면 다우 지수는 152.87p(0.31%) 내린 4만9499.27로 장을 마쳤다.다우 지수는 '순환매' 속에 올 들어 2월까지 3대 지수 가운데 가장 가파른 상승세를 보이며 사상 최고 기록을 갈아치웠지만 2월 9일 5만135.87로 사상 최고치를 찍은 뒤로는 잠잠하다.3대 지수는 주간 단위로는 모두 상승했다.다우 지수가 0.55% 상승률로 가장 낮았고, S&P500과 나스닥은 각각 0.91%, 1.12% 뛰었다.'월가 공포지수' 시카고옵션거래소(CBOE) 변동성지수(VIX)는 0.08p(0.47%) 오른 16.97을 기록했다.애플, 3.2% 급등빅테크들은 대체로 오름세를 탔다.'가장 인기 있는' 아이폰 17 덕에 전날 깜짝 분기실적을 공개한 애플은 8.80달러(3.24%) 급등한 280.15달러로 마감했다. 장중 상승률이 5.85%에 이를 정도로 강세를 보였다.전날 10% 가까이 폭등한 알파벳은 차익실현 매물 속에서도 신규 매수가 유입돼 1.28달러(0.34%) 오른 383.22달러로 마감했다. 주가가 이틀 연속 사상 최고 기록을 새로 썼다.마이크로소프트(MS)는 6.66달러(1.63%) 상승한 414.44달러, 테슬라는 9.04달러(2.37%) 뛴 390.67달러로 올라섰다.팔란티어도 4.96달러(3.57%) 급등한 144.07달러로 장을 마쳤다.반도체 강세반도체 종목들은 대체로 강세였다.전날 숨 고르기에 들어갔던 마이크론과 인텔은 다시 뛰었다.인텔은 5.14달러(5.44%) 급등한 99.62달러, 마이크론은 25.05달러(4.84%) 뛴 542.21달러로 장을 마쳤다.인텔은 가파른 주가 상승세로 인해 선행 주가수익배율(PER)이 99배에 육박할 정도로 높지만 마이크론은 주가 폭등에도 불구하고 5.82배로 시장 평균을 크게 밑돌고 있다.AMD는 6.05달러(1.71%) 상승한 360.54달러, 브로드컴은 3.85달러(0.92%) 오른 421.28달러로 마감하며 오름세를 이어갔다.반도체 상장지수펀드(ETF)인 아이셰어즈 반도체 ETF(SOXX)는 4.31달러(0.93%) 상승한 465.75달러로 거래를 마쳤다.반면 대장주 엔비디아는 나흘 연속 하락했다. 이날은 1.12달러(0.56%) 내린 198.45달러로 마감했다.엔비디아는 지난달 27일 사상 최고 종가 기록인 216.61달러를 찍은 뒤 내리막길을 걷고 있다.",True,반도체,"뉴욕 증시가 반도체 강세 덕분에 S&P500과 나스닥이 이틀 연속 사상 최고치를 경신했으나, 다우는 약세로 돌아섰다. 애플과 반도체 기업들이 강세를 보였으며, 엔비디아는 하락세를 지속했다.",인텔,2.0
2026-05-02,"끊임 없는 AI 투자…월가, 낙관론 속에 의구심도 솔솔",정보 없음,https://n.news.naver.com/mnews/article/023/0003974276,"AI 서비스 기업들 대규모 투자로보유 현금 급속히 감소해 우려투자가 매출 확대로 연결 안되면반도체 제조업체로 불똥 튈 수도미국 주식 시장이 AI(인공지능) 붐에 힘입어 연일 사상 최고가를 경신하고 있지만, 낙관론 속에 의구심도 고개를 들고 있다.2일 외신에 따르면 S&P500과 나스닥 지수 등 미국 주가는 AI 관련 반도체 주식이 주도하면서 연일 강세장을 연출하고 있다. AI에 필요한 CPU(중앙연산처리장치)를 생산하는 인텔의 주가는 최근 급등했는데, 일일 주가 상승 폭은 1987년 이래 가장 컸다. 이러한 주가 상승은 월스트리트 투자자들이 AI 붐을 낙관하기 때문이다.미국 AI 관련 기업들이 대규모 시설 투자로 인해 현금 보유액이 급속히 감소하자 월스트리트 투자자 사이에서 의구심이 조금씩 나오고 있다. 사진은 뉴욕증권거래소 외관./EPA 연합뉴스투자자들은 로봇 등이 사용자의 지시를 일일이 받지 않고 독자적으로 움직여 사용자의 수요에 맞는 해법을 찾는 자율형 AI 시대가 이제 막 시작한 단계라고 보고 있다. 이에 따라 관련된 인프라 투자가 향후 급증할 것으로 예상한다. 이를 위해서는 엔비디아의 GPU(그래픽처리장치)나 인텔·AMD의 CPU 반도체가 필수적이며, 이러한 수요를 미리 반영해 인텔 등 관련 기업들의 주가가 급등하고 있다.뜨거운 낙관론월스트리트 전문가들은 올해 미국의 거대 IT(정보기술) 기업들이 AI 인프라 투자를 빠른 속도로 늘려 총투자 규모가 6500억달러에 이를 것으로 보고 있다. 특히 AI 붐에 대한 투자자들의 견해가 워낙 낙관적이어서 이렇게 빠르게 증가하는 투자 속도가 언제 둔화될지 아직 짐작하기 어려운 상황이다.AI 붐의 수혜주인 반도체 주식은 기본적으로 경기순환주이다. 반도체 경기는 호황과 불황을 반복해왔고, 이에 따라 주가도 등락을 거듭해왔다. 하지만 지금의 AI 붐은 너무 강렬해 반도체 경기의 정점과 저점을 가늠하기 힘들다는 것이 전문가들의 분석이다.반도체 제조업체인 인텔의 주가가 AI 붐에 힘입어 최근 급등했다. 사진은 컴퓨터 기판과 합성되어 있는 인텔 로고./로이터 연합뉴스그래서 인텔이나 AMD가 만드는 CPU 수요는 공급 부족이 심화될 것이라는 전망이 쏟아지고 있다. 반도체를 넘어 AI와 관련된 연결망 기업들도 주가가 급등하고 있다. 이란 전쟁의 불확실성이나 배럴당 100달러를 넘어 고공행진하는 유가에도 불구하고 증권사 애널리스트들은 향후 수개월간 주가가 계속 최고점을 경신할 것으로 본다. 특히 AI 관련주이면서도 AI 기술 혁신으로 악영향을 적게 받을 전력 관련 주식을 주목하라고 추천하고 있다.급감하는 현금월스트리트의 낙관론 속에서 의구심이 조금씩 고개를 들고 있는 이유는 기업들이 대규모 AI 시설 투자에 나서면서 보유한 현금이 급격하게 줄고 있기 때문이다. 기업은 회계상 이익이 나도 현금흐름이 좋지 않으면 배당을 하기 어렵고 흑자 부도를 맞을 수 있다.아마존의 클라우드 서비스인 아마존웹서비스(AWS)는 올해 1분기에 376억달러의 매출을 기록해 매출이 전분기보다 28%나 증가했다. 투자자들의 기대치에는 미치지 못하지만 매우 좋은 실적이다. 하지만 아마존이 보유한 잉여현금은 작년 1분기 약 260억달러에서 올해 1분기 12억달러로 1년간 95%나 감소했다. 잉여현금은 기업이 영업활동을 해서 벌어들인 돈으로 투자를 하고 빚을 갚은 뒤에 남는 현금이다. 기업은 이 잉여현금으로 신규 사업에 투자하거나 주주들에게 배당을 한다.아마존웹서비스(AWS)는 지난 1년간 대규모 AI 관련 시설투자로 현금 보유액이 격감했다. 사진은 아마존웹서비스가 주최한 2023년 박람회./아마존웹서비스아마존은 잉여현금이 급격히 감소한 이유에 대해 지난 1년간 영업 활동을 통해 이익이 30%나 늘었지만, 더 큰 폭으로 AI 관련 대규모 투자를 했기 때문이라고 설명한다. 아마존은 올해 AI와 클라우드 서비스 위주로 432억달러를 투자할 예정이다.앤디 제시 아마존 CEO는 “인공지능 관련 대규모 투자로 당분간 현금 사정이 나빠질 가능성이 있지만 장기적으로는 실적이 더 좋을 것이라고 낙관하고 있다”고 말했다. 예컨대 AI와 클라우드 서비스 관련해 이미 확보한 수주가 3640억달러에 이른다는 설명이다.메타는 대규모 AI 시설투자가 광고 단가 상승에 따른 수익 증가를 상쇄하고 있다. 사진은 미국 캘리포니아주의 메타 본사./AP 연합뉴스메타의 경우에도 사정이 비슷하다. 메타는 올해 광고 단가가 작년보다 12%나 증가했다고 발표했다. 하지만 동시에 올해 시설 투자 규모도 당초 추정한 규모보다 10% 정도 더 늘어날 것으로 보고 있다. 광고 단가가 올라 매출과 영업이익이 늘기도 하지만 대규모 시설 투자가 영업이익을 상쇄하는 형태이다.이에 따라 월스트리트 투자자들의 관심은 AI 서비스 업체들의 대규모 투자가 매출이나 영업이익의 증가로 이어지느냐에 모아지고 있다. 투자가 이익으로 연결되지 못하면 주주들에게 배당을 제대로 줄 수 없을 뿐 아니라, 과잉투자를 줄이는 과정에서 연쇄적으로 반도체 제조업체의 수익에도 악영향을 끼칠 수 있다.",True,AI 반도체,"미국 AI 기업들이 대규모 투자로 현금이 급감하며 우려가 커지고 있다. AI 인프라 수요 증가 기대와 반도체 주가 강세는 지속될 전망이지만, 투자와 수익 간 불일치 가능성에 투자자들의 의구심도 높아지고 있다.",인텔,2.0
2026-05-01,중동 여파에도 '반도체 슈퍼사이클'…사상 첫 2月 연속 800억불↑(종합2보),정보 없음,https://n.news.naver.com/mnews/article/003/0013921386,"산업부, 4월수출입동향…무역수지 237.7억弗 흑자 15개월 연속사상 첫 2개월 연속 800억弗 달성…일평균 수출도 30억弗 초과반도체 319억弗 전년대비 173.5%↑…2개월 연속 300억弗 돌파15대 수출 품목 중 8개 품목↑…9개 수출지역 중 7개 지역 증가[인천=뉴시스] 전진환 기자 =인천 연수구 인천신항 컨테이너 터미널에 컨테이너가 쌓여 있다. 2026.04.01. amin2@newsis.com[세종=뉴시스]김동현 이수정 기자 = 중동 사태에도 불구하고 우리나라 수출이 3월에 이어 4월에도 800억 달러 이상을 기록하며 사상 첫 2개월 연속 800억 달러 수출이라는 신기록을 썼다. 4월 일평균 수출은 35억8000만 달러로 3개월 연속 30억 달러를 초과한 것으로 집계됐다.반도체 슈퍼사이클은 4월에도 지속됐다. 반도체는 고대역폭메모리(HBM)와 더블데이터레이트(DDR) 등 고부가 메모리 반도체 수요 견조에 힘입어 2개월 연속 수출 300억 달러 이상 및 13개월 연속 월 역대 최대 실적을 올렸다.1일 산업통상부가 발표한 '4월 수출입동향'에 따르면 수출은 1년 전보다 48.0% 증가한 858억9000만 달러(126조8595억원), 수입은 16.7% 증가한 621억1000만 달러(91조7365억)를 기록한 것으로 집계됐다.무역수지는 전년동월대비 237억7000만 달러 흑자를 달성했다. 무역수지는 역대 4월 중 최대실적 경신 및 지난해 2월 이후 15개월 연속 흑자를 달성했다. 수출은 11개월 연속 플러스 흐름을 이어갔고 4월 수출은 역대 4월 중 1위를 달성했다.조업일수를 고려한 일평균 수출은 48.0% 증가한 35억8000만 달러를 기록한 것으로 나타났다. 일 평균 수출은 3개월 연속 30억 달러를 돌파했다.[서울=뉴시스] 지난달 우리나라 수출은 1년 전보다 48.0% 증가한 858억9000만 달러(126조8595억원), 수입은 16.7% 증가한 621억1000만 달러(91조7365억)를 기록한 것으로 집계됐다. 사상 첫 2개월 연속 800억 달러 수출을 달성했다. 무역수지는 237억7000만 달러 흑자를 기록했다. (그래픽=안지혜 기자)  hokma@newsis.com품목별로 살펴보면 15대 주력 수출 품목 중에선 8개 품목 수출이 증가했다. 반도체와 컴퓨터, 바이오헬스는 역대 수출액 1위를 달성했고 석유제품 2위, 자동차는 3위의 역대 수출액을 기록한 것으로 나타났다.최대 수출 품목인 반도체는 173.5% 증가한 319억 달러(47조1163억원)의 수출액을 기록했다. 반도체 수출은 2개월 연속 수출 300억 달러를 넘겼으며, 13개월 연속 해당 월 역대 최대 실적을 세웠다.D램 고정가격이 반등한 가운데 HBM 등 고부가 메모리 수출 호조세도 지속된 영향이다. DDR4 가격은 지난해 4월에 비해 870% 증가했고, DDR5 가격도 662% 급등했다. 낸드 플래시 단가 역시 같은 기간 776% 상승한 것으로 집계됐다.자동차 수출은 중동전쟁으로 인한 물류차질 지속과 미국의 관세 부과에 따른 현지생산 확대 등으로 전년대비 5.5% 줄어든 61억7000만 달러의 수출을 기록했다.차종별로 내연기관차 수출액이 17% 줄어든 36억 달러를 기록했으나, 전기차·하이브리드차 등 친환경차의 수출은 증가세를 보였다. 전기차는 23% 늘어난 9억 달러, 하이브리드차는 9% 늘어난 16억 달러를 기록했다.바이오 헬스는 미국과 유럽연합(EU) 등 글로벌 시장에서 바이오시밀러 점유율 확대 및 위탁개발생산(CDMO) 수주 강세 등의 영향으로 16억 달러(+19%)의 수출액을 올리며 6개월 연속 플러스를 보였다.선박은 단가가 높은 액화천연가스(LNG) 선박을 중심으로 선박 인도량이 증가하면서 44% 증가한 29억 달러를 수출액을 달성했다. 선박은 3개월 연속 수출 증가세를 보였다. 국가별로는 EU 7억9000만 달러(+152.6%), 아세안 2억2000만 달러(+21.7%) 등의 수출액을 보였다.무선통신기기는 갤럭시 S26 등 프리미엄 제품 판매 호조세로 완제품 중심의 수출 증가세가 이어지며 6개월 연속 수출 플러스를 기록했다. 무선통신기기 수출액은 전년대비 11.6% 증가한 16억2000만 달러를 기록했다. 국가별로는 중국 5억1000만 달러(+14.1%), 미국 2억8000만 달러(+35.7%) 등이다.[서울=뉴시스]컴퓨터 수출은 인공지능(AI) 인프라 수요 확대에 따른 고속 데이터 저장장치 솔리드스테이트드라이브(SSD) 초과 수요가 지속되면서 전년동월대비 515.8% 증가한 40억8000만 달러를 기록했다. 이는 25억6000만 달러를 기록한 올해 2월과 34억2000만 달러를 기록한 3월에 이어 2개월 연속 월 기준 최대실적이다. 국가별로는 미국 17억 달러(+1183.2%), EU 3억6000만 달러(250.8%), 중국 3억3000만 달러(285.8%) 등의 수출이 상승했다.디스플레이는 반도체 가격 상승에 따른 출하량 조정, 신제품 출시 예정에 따른 기존제품 재고소진 등으로 전년동월대비 2.7% 감소한 12억9000만 달러의 수출액을 올렸다. 디스플레이는 아세안에서 6억8000만 달러(10.1%)로 증가세를 보였다.철강은 주요 철강사의 가격인상과 중동사태 등으로 수출 단가가 올랐지만 수출 물량이 감소하면서 전체 수출은 마이너스를 보인 것으로 나타났다. 4월 수출액은 26억2000만 달러로 11.6% 줄었다. 국가별 철강 수출은 미국 2억9000만 달러(+21.4%), EU 3억 달러(-0.3%) 등으로 집계됐다.일반기계는 미국의 관세 및 중동전쟁에 따른 운송차질, 물류비용 증가의 영향으로 전년동월대비 2.6% 감소한 29억 달러의 수출액을 올렸고 차부품은 미국의 관세부과, 완성차 업체의 현지생산 비중 확대로 19억 달러(-6.0%)를 기록했다.석유제품 수출은 중동 전쟁으로 인한 유가 급등으로 수출 단가가 크게 상승하며 전년동월대비 39.9% 증가한 51억1000만 달러를 기록했다. 다만 수출 물량은 수출 통제로 인해 36.0% 줄어든 것으로 집계됐다.특히 수출통제 영향으로 휘발유·경유·등유의 수출은 전년대비 각각 약 43.0%, 23.2%, 99.9% 감소했다.석유화학 수출은 유가 상승의 제품가격 반영까지의 시차로 수출단가가 소폭 상승한데 힘입어 7.8% 증가한 40억9000만 달러를 기록했다. 수출 물량은 내수 공급 증가에 따라 20.9% 줄었다.이차전지와 가전 수출도 감소세를 보였다. 이차전지는 핵심광물 가격 상승에 따라 수출 단가가 올랐지만 3월 잔여물량이 일괄 출하되며 수출 물량이 줄었고 전체 수출은 6억5000만 달러로 6.5% 감소했다.가전은 중동사태 및 미국의 관세 영향과 더불어 주력 시장인 미국 내 대형가전 수요 둔화가 이어지며 5억6000만 달러(--20.0%)의 수출액을 기록했다. 섬유는 K-패션 수요가 확대되며 전년동기대비 3.8% 증가한 9억4000만 달러의 수출액을 올렸다.15대 주력품목이 아닌 품목들의 수출도 호조세를 이어갔다. 전기기기 15억7000만 달러(+7.6%), 화장품 13억7000만 달러(+33.4%), 농수산식품 12억2000만 달러(+8.8%) 등 유망 품목 수출은 각각 4월 중 역대 최대실적을 기록했다.[서울=뉴시스]SK하이닉스는 22일 서울 코엑스에서 개막한 한국반도체산업협회 주최 'SEDEX 2025(제27회 반도체대전)'에 참석해 최신 고대역폭메모리인 'HBM4'와 차세대 서버용 저전력 D램 '소캠(SOCAMM2)' 등 공개했다. photo@newsis.com4월에는 9대 주요 수출지역 중 7개 지역에서 수출이 증가했다.미국은 전년동월대비 54.0% 증가한 163억3000만 달러의 수출액을 기록했다.반도체와 컴퓨터 등 관세 예외 품목 위주로 높은 수출 증가율을 보였지만 자동차·차부품·일반기계 등 관세 대상 품목 수출은 부진한 것으로 나타났다.대미 반도체 수출은 787% 증가한 35억 달러, 컴퓨터 수출은 1183% 증가한 17억 달러를 기록했다. 대미 자동차 수출은 12% 감소한 22억 달러, 차부품은 13% 감소한 6억 달러, 일반기계 8억5000만 달러(-12.4%)로 집계됐다.중국 수출은 62.5% 오른 177억5000만 달러로 집계됐다. 반도체를 비롯해 컴퓨터·무선통신기기 등 IT 품목 수출이 호조세를 보이면서 6개월 연속 수출 플러스를 기록한 것으로 나타났다.구체적으로 반도체가 183% 오른 84억 달러, 컴퓨터가 286% 오른 3억 달러, 무선통신기기가 14.1% 오른 5억1000만 달러를 기록하며 상승세를 이끌었다. 석유화학은 14.2% 감소한 10억3000만 달러의 수출액을 기록했다.아세안은 반도체·석유제품·디스플레이 등 주요 품목 수출이 고르게 증가하면서 154억1000만 달러(+64.0%)의 수출액을 달성했다. 반도체는 55억5000만 달러(147.9%), 석유제품 11억1000만 달러(37.7%) 등이다.EU는 반도체, 바이오헬스, 선박 등 주력 품목 수출의 호조세로 8.5% 증가한 71억5000만 달러를 기록했다. 유럽으로의 수출은 5개월 연속 증가세를 보였다.세부적으로 선박 7억9000만 달러(152.6%), 반도체 5억9000만 달러(136.2%), 바이오헬스 4억6000만 달러(+12.8%),자동차 5억5000만 달러(-25.3%) 등으로 집계됐다.중동 수출은 중동 전쟁에 따른 물류 차질과 불확실성 등으로 주력품목인 자동차·일반기계 등 대다수 품목이 감소한 영향을 받아 전년동월대비 25.1% 감소한 12억7000만 달러를 기록했다. 반도체 3000만 달러(+258%), 자동차 1억9000만 달러(-43.7%), 일반기계 1억4000만 달러(-37.1%), 자동차부품 5000만 달러(-16.7%) 등이다.[평택=뉴시스] 김종택 기자 = 3일 경기 평택시 포승읍 평택항 자동차 전용부두에 수출용 차량이 세워져 있다.2026.04.03. jtk@newsis.com중남미는 반도체, 자동차, 컴퓨터 등 주요 품목 수출이 대폭 증가하면서 전년대비 10.0% 증가한 28억5000만 달러의 수출액을 올렸고 일본은 석유제품과 석유화학, 반도체 등 주요 품목 수출이 고르게 늘어나면서 29억6000만 달러(28.4%)의 수출액을 올린 것으로 나타났다. 일본 수출은 3개월 연속 플러스를 달성했다.인도에선 반도체, 석유화학, 일반기계 등 주력 품목 수출 위주 증가세 지속되면서 전년대비 41.9% 증가한 24억2000만 달러의 수출액을 보였고, 독립국가연합(CIS) 수출은 자동차, 자동차 부품 등 주력 품목의 수출 감소로 전년대비 11.7% 감소한 10억3000만 달러의 수출액을 보였다.4월 수입은 16.7% 증가한 621억1000만 달러로 집계됐다. 이에 무역수지는 전년 대비 189억7000만 달러 증가한 237억7000만 달러(35조1080억원) 흑자로 역대 4월 중 최대 실적을 경신했다.에너지 수입은 106억1000만 달러로 전년대비 7.5% 늘었고 에너지 외 수입은  515억1000만 달러로 18.8% 증가한 것으로 집계됐다. 원유 수입은 중동 전쟁으로 수입 물량은 감소했지만 유가 급증에 따른 수입단가 상승으로 13.1% 증가한 70억 달러를 기록했다. 비에너지 부문에서는 컴퓨터 17억8000만 달러(+35.6%), 반도체장비 25억1000만 달러(+59.9%) 등의 수입이 증가했다.김정관 산업통상부 장관은 ""4월 수출과 무역수지는 중동 전쟁이 두 달 이상 이어지는 가운데, 사상 처음으로 2개월 연속 수출 800억 달러 이상, 무역수지 200억 달러 이상을 기록했다""며 ""이는 전세계적인 AI 투자 확대, 유가 상승에 따른 석유제품 단가 상승 속에서 우리 기업들이 선제적으로 공급망을 확보했기 때문에 가능한 결과""라고 평가했다.이어 ""주요 품목 경쟁 심화, 중동 전쟁에 따른 원재료 수급 어려움 등  수출 변동성이 확대될 우려가 있다""며 ""정부는 마켓팅·금융·보험 지원과 수출 시장 다변화 정책 등을 통해 수출 기업의 부담을 최소화하고 원유·나프타 등 대체 물량을 추가 확보함으로서 기업들이 글로벌 경쟁력을 지속 발휘할 수 있는 여건을 만들어 나가겠다""고 밝혔다.[서울=뉴시스] 김정관 산업통상부 장관이 25일 서울 서초구 KOTRA에서 열린 제1차 민관합동 수출확대회의에서 발언하고 있다. (사진=산업통상부 제공) 2026.02.25. photo@newsis.com *재판매 및 DB 금지",True,반도체,"산업부 발표에 따르면, 4월 우리나라 수출은 858억9000만 달러로 48% 증가하며 2개월 연속 800억 달러 돌파, 사상 첫 기록을 세웠다. 반도체 수출은 173.5% 급증했고, 바이오헬스, 컴퓨터 등도 역대 최고치를 기록했다. 무역수지는 237억7000만 달러 흑자로 15개월 연속 흑자 행진을 유지했다.",반도체,2.0
