date,title,company,link,content,관련성,키워드,summary,검색어,importance
2026-05-04,"""반도체 공급부족 심각해진다""…외국인, 삼전닉스만 3조 순매수",정보 없음,https://n.news.naver.com/mnews/article/015/0005282946,"칠천피까지 63.01포인트예상 밖 코스피 랠리빅테크 AI인프라 투자 확대 영향하이닉스, 美 ADR 상장 기대감도삼성전자 5% 올라 23만원 넘어4일 코스피지수가 5.12% 오른 6936.99에 마감하며 7000 돌파를 눈앞에 뒀다. 이날 서울 하나은행 본점 딜링룸 전광판에 코스피지수가 표시돼 있다.   최혁 기자증권시장의 오랜 격언인 ‘셀 인 메이’(Sell in May·5월엔 팔고 떠나라)가 올해도 통할 것인가. 노동절 연휴를 앞둔 지난달 말 증권업계의 관심은 여기에 쏠렸다. 코스피지수가 4월 한 달간 5000대에서 6600대로 쉼 없이 질주한 만큼, 삼성전자와 SK하이닉스 주가가 숨 고르기에 들어갈 것이란 예측이 적지 않았다. 통상 실적 발표가 마무리되는 5월에 전체 증시가 부진한 패턴을 보인다는 점도 우려를 더했다.하지만 5월의 첫 거래일인 4일 코스피지수는 역대 최고치를 찍으며 7000 돌파를 눈앞에 뒀다. 주가 상승세가 둔화할 것으로 예상된 SK하이닉스와 삼성전자는 이날 하루에만 각각 12%, 5%대 강세를 보이며 상승장의 주역이 됐다. 연휴 사이 잇달아 발표된 글로벌 빅테크의 호실적으로 인공지능(AI)발 반도체 슈퍼사이클이 계속될 것이라는 기대가 커졌다.◇외인, 노조 리스크 없는 하닉 ‘베팅’이날 유가증권시장 상승을 주도한 건 외국인과 기관이었다. 한국거래소에 따르면 외국인과 기관은 이날 5조원 가까이 순매수했다. 개인이 4조7935억원어치를 팔아치운 것과 대조적이다. 외국인이 가장 많이 사들인 종목은 SK하이닉스(1조7031억원)였다. 삼성전자(1조2052억원), 삼성전자우(1628억원), 한화에어로스페이스(1221억원) 등이 그 뒤를 이어 외국인 순매수 상위권에 들었다. 이에 힘입어 SK하이닉스는 ‘140만닉스’와 ‘시가총액 1000조원 돌파’를 동시에 달성했다. 전 거래일 대비 상승률은 12.52%로 지난달 8일(12.77%)에 이어 역대 두 번째로 높았다. 삼성전자(5.44%)의 상승폭을 두 배 이상 웃돌았다.이영곤 토스증권 리서치센터장은 “빅테크들의 AI 관련 투자 확대 흐름이 이어질 것이란 전망이 반도체주 상승세를 이끌고 있다”며 “삼성전자와 SK하이닉스 모두 수혜를 보겠지만, SK하이닉스는 삼성전자와 비교해 노조 파업 가능성 등 불확실성이 작다는 점이 매수 심리를 자극한 것으로 보인다”고 했다. 오는 6~7월께 미국예탁증서(ADR) 상장을 앞두고 있어 기업 가치를 재평가받을 수 있다는 점도 주가를 밀어 올린 요인으로 꼽힌다.AI 낙관론이 대외 불확실성을 압도했다는 평가가 나온다. 나정환 NH투자증권 연구원은 “전쟁 상황과 유가 흐름 등만 놓고 보면 한국 증시에 부정적인 요인이 많지만, 반도체 투톱 실적 기대가 선반영되면서 상승장을 이끌었다”고 평가했다. 연휴 사이 애플 등 빅테크가 ‘깜짝 실적’과 대규모 AI 데이터센터 증설 계획을 발표하면서 S&P500지수와 나스닥지수가 이틀 연속 상승한 것이 한국 증시를 밀어 올렸다는 얘기다.◇가파른 상승에 공매도 잔액도 급증가파른 상승세에도 글로벌 투자은행(IB)과 증권사들은 여전히 ‘한국 증시는 싸다’는 의견을 고수하고 있다. 국내 증시를 주도하는 대형 반도체주의 이익 전망치가 주가 상승 속도보다 더 가파르게 증가하고 있다는 게 핵심이다.골드만삭스는 최근 발간한 삼성전자 관련 보고서에서 2027년 영업이익 전망치를 기존 307조원에서 438조원으로, 2028년 전망치를 318조원에서 495조원으로 40~50% 상향 조정했다. “2027년 메모리 시장은 현재보다 더 극심한 공급 부족 상황이 전개될 것”이라는 이유다. 목표주가도 기존 28만5000원에서 32만원으로 올려 잡았다. 이날 삼성전자의 12개월 선행 주가수익비율(PER)은 6.11배다. SK하이닉스도 5.07배에 그친다.다만 코스피지수의 일시적 하락에 베팅하는 투자자도 늘고 있다. 한국거래소에 따르면 유가증권시장의 공매도 순보유 잔액은 지난달 27일 20조원을 돌파했다.",True,반도체,"4월 이후 급등한 코스피가 7000 돌파를 눈앞에 두고 있으며, 삼성전자와 SK하이닉스가 AI·반도체 수혜 기대와 외국인 매수로 강세를 보이고 있다. 글로벌 빅테크 호실적과 ADR 상장 기대도 주가를 견인하며, 공매도 잔액도 늘어나고 있다.",AI 반도체,2.0
2026-05-05,"복잡한 반도체 자동 설계 AI 모델 개발…""시간 최대 76%↓""",정보 없음,https://n.news.naver.com/mnews/article/092/0002421324,"UNIST·경북대 연구팀, 회로-레이아웃 전 과정 통합 자동화 솔루션 개발반도체 자동 설계 시간을 최대 76% 줄일 수 있는 인공지능(AI) 기술이 개발됐다.UNIST는 윤희인 전기전자공학과 교수와 송대건 경북대학교 교수팀이 통신 회로인 LC(인덕터-캐퍼시티) 전압제어 발진기(LC-VCO)를 회로 설계 단계부터 실제 칩에 넣는 물리적 레이아웃까지 자동 설계해주는 AI 모델을 개발했다고 5일 밝혔다.LC-VCO는 5G 같은 고속 통신 시스템에서 주파수를 만들어내는 반도체 회로다. 신호 잡음과 전력 소모를 줄이기 위해서는 인덕터, 트랜지스터 크기와 같은 변수를 잘 조합해 회로를 설계해야 한다.강화학습과 경사하강법을 결합한 LC(인덕터-캐퍼시티) 전압제어 발진기(LC-VCO)  자동 설계 아키텍처.(그림=UNIST)연구팀은 회로 설계와 레이아웃 설계를 통합, 최적화했다. 회로 설계 단계에서는 강화학습을 적용해 설계 변수들을 바꿔가며 목표 주파수와 성능을 만족하는 조합을 찾도록 했다. 실제 칩 구조가 결정되는 레이아웃 단계에서는 경사하강법을 이용했다. 이는 배선 폭과 간격 같은 물리적 설계 변수를 성능이 개선되는 방향으로 반복 보정한다.연구팀은 “회로도 설계(Schematic)와 물리적 배치(Layout)를 개별적으로 최적화하던 기존 방식을 대신 AI가 두 단계를 통합적으로 관리하도록 한 기술”이라고 설명했다.설계 과정에서 시간이 가장 많이 걸리는 인덕터는 딥러닝 기반 예측을 활용해 전체 설계 시간을 줄였다.윤희인 교수는 ""설계자의 반복적인 전자기 시뮬레이션이 필요한 작업을 단 몇 밀리초(ms) 만에 완료할 수 있다""며 ""실험 결과, 기존 자동 설계 방식이 약 119시간 소요되는 작업을 단 28.5시간 만에 완료해 설계 시간을 76% 이상 단축했다""고 말했다.또 전이 학습이 적용돼 반도체 나노 공정 노드가 바뀌어도 기존에 학습한 내용을 바탕으로 설계를 이어갈 수 있다. 예를 들어 65nm 공정으로 학습한 AI는 40nm나 28nm 공정에서도 처음 학습에 필요했던 데이터의 약 10%만 추가로 활용해 설계를 수행할 수 있다.연구팀은 “5G·6G 통신과 AI 칩의 핵심 부품인 주파수 생성 회로의 성능은 높이면서 설계 비용은 크게 낮출 수 있을 뿐만 아니라 중장기적으로 반도체 설계 인력 부족 문제를 해결하고 차세대 공정으로의 전환 속도를 획기적으로 앞당길 수 있는 도구”라고 기대했다.UNIST 연구진. 윤희인 교수(왼쪽)와 김성진 연구원.(사진=UNIST)연구팀은 LC-VCO뿐만 아니라 향후 다양한 아날로그/RF 회로 설계 자동화 연구로 확장할 계획이다.연구 결과는 IEEE 반도체 회로 공학회에서 발행하는 국제 학술지 ‘IEEE 집적회로 및 시스템 설계자동화(TCAD)’에 4월 3일 온라인 공개됐다.",True,AI 반도체,"UNIST와 경북대 연구팀이 회로-레이아웃 전 과정 통합 AI 솔루션을 개발, 반도체 설계 시간을 76% 단축했다. 강화학습과 딥러닝을 활용해 설계 효율성을 높였으며, 5G·6G 통신 핵심 부품 개발에 기여할 전망이다.",AI 반도체,1.0
2026-05-05,"영재학교서 반도체 노릴까, 일반고에서 의대 도전할까",정보 없음,https://n.news.naver.com/mnews/article/009/0005675470,"종로학원 전국 8개 영재학교 분석지역의사제·반도체 인기 등 변수영재학교 선발인원현재 중학교 3학년이 치를 2027학년도 영재학교(영재고) 입시가 이달 시작된다. 과학영재 발굴·교육을 목표로 하는 이공계 최상위권 고교인 영재학교를 두고 상위권 학생들의 선택에 관심이 모인다.한국과학기술원(카이스트) 부설 한국과학영재학교가 오는 6일부터 학생 모집을 하는 것을 시작으로, 서울과학고와 경기과학고, 인천과학예술영재학교, 세종과학예술영재학교 등이 이번 달에 신입생을 선발한다. 2027학년도 영재학교 8곳의 신입생은 총 789명 규모다.이번 영재학교 지원을 통해 최상위권 학생들의 진로 선호도를 점쳐볼 수 있을 것이라는 예측이 나온다. 그동안 영재학교는 많은 지원을 받는 만큼 이공계가 아닌 의대에 지원할 경우 다양한 제약을 받아왔다. 의약학 계열 대학 진학과 관련한 진로·진학 지도를 받을 수 없고, 학교 밖 교육·연구 활동으로 이룬 성과는 학생부에 기재할 수도 없다. 의대 진학시 그동안 받은 장학금도 반환해야 한다.실제로 의대 열풍이 불면서 영재학교 입시 경쟁률은 하락세를 보이기도 했다. 2025학년도 영재학교 7곳의 입시 경쟁률(한국과학영재학교는 비공개)은 5.96대 1이었고, 2026학년도에는 5.72대 1로 소폭 하락한 바 있다. 그러나 최근 AI·반도체 관련 학과에 대한 관심이 커지면서 이공계열 대학 진학을 염두에 둔 영재학교 지원자가 늘어날 가능성이 있다.임성호 종로학원 대표는 “반도체 관련 전공은 산업 활황과 억대 성과급으로 학생들의 수요가 늘어날 수 있고, 의대의 경우 지역의사제라는 새 입학 통로가 생겨 의대를 준비하는 학생들이 많아질 수 있다”며 “2027학년도 영재학교 모집 결과는 의대와 공대에 대한 학생들의 선호도를 살펴볼 수 있는 지표가 될 것”이라고 밝혔다.",True,AI 반도체,"2027학년도 영재학교 입시가 시작되면서, 이공계와 반도체·의대 선호도 변화가 주목된다. 지원자 수와 경쟁률은 지난해보다 소폭 하락했으나, AI·반도체 관심 증가로 지원자 수가 늘어날 가능성이 있다.",AI 반도체,1.0
2026-05-05,"반도체로 못 막는다…ADB ""한국 성장률 1.9% 하회 가능성""",정보 없음,https://n.news.naver.com/mnews/article/008/0005353105,"앨버트 박 ADB 수석 이코노미스트아시아개발은행(ADB)이 한국의 경제성장률을 기존 전망치인 1.9%보다 낮아질 수 있다고 전망했다. 반도체 경기 호조에도 불구하고 중동전쟁 장기화 등 올해 에너지 가격 상승과 공급 충격이 성장 하방 압력을 더 크게 만들 수 있다는 판단이다.앨버트 박 ADB 수석 이코노미스트는 4일(현지시간) 우즈베키스탄 사마르칸트 ADB 연차총회에서 한국 기자들과 만나 올해 한국 경제 성장률에 대해 ""예상보다 강했던 반도체 경기 호조를 감안하더라도 ADB의 4월 전망치(1.9%)보단 성장률이 낮아질 것으로 본다""고 밝혔다.ADB는 지난달 10일 한국의 올해 성장률을 1.9%로 제시한 바 있다. 이는 중동전쟁이 단기간 내 안정되며 유가가 배럴당 69달러 수준으로 빠르게 정상화되는 시나리오를 전제로 했다.그러나 최근 분석에선 에너지 인프라 훼손과 공급 차질로 유가가 더 높은 수준에서 장기간 유지될 가능성이 높다고 봤다. ADB는 새로운 기준 시나리오에서 국제유가가 올해 배럴당 평균 96달러, 내년 80달러 수준을 유지할 것으로 전망했다.이를 반영하면 에너지 수입 의존도가 높은 한국 성장률은 올해 약 0.9%포인트, 내년 약 0.5%포인트 낮아질 것으로 추정된다. 다만 반도체 수출 호조는 하방 압력을 일부 상쇄하는 요인으로 꼽힌다.박 이코노미스트는 ""중동전쟁 장기화로 인한 하방 영향과 반도체 경기 호조의 상승 영향을 합쳐서 평가하진 않았다""며 ""7월 발표할 경제전망에서 변화된 여건을 반영해 보다 정교한 전망을 제시할 것""이라고 말했다.최근 한국 경제를 견인하고 있는 반도체 경기와 관련해서는 기존과 다른 구조적 호황으로 사이클이 오래 지속될 것이라는 평가가 나왔다.박 이코노미스트는 ""이번 반도체 사이클은 인공지능(AI) 투자가 주도한다는 점에서 과거와 근본적으로 다르다""며 ""글로벌 IT 기업 중심의 투자 확대와 생산성 향상 효과가 확인되고 있다""고 말했다.다만 ""데이터센터 등을 중심으로 과잉 투자 우려도 존재해 단기적으로 변동성이 나타날 수 있다""면서도 ""장기적으로는 확장 추세가 이어질 가능성이 높다""고 전망했다. 이어 ""한국은 이러한 변화에서 매우 유리한 위치에 있다""고 덧붙였다.중동 사태로 제기된 스태그플레이션(고물가 속 경기침체) 우려에 대해서는 한국의 경우 상대적으로 위험이 크지 않다고 진단했다.박 이코노미스트는 ""한국은 반도체 수출 호조 덕분에 성장 기반이 견조하다""며 ""중동 사태가 조기 해결된다면 물가도 점진적으로 나아질 수 있기 때문에 스태그플레이션 우려는 생각하지 않는다""고 말했다.다만 ""한국은 에너지 수입 의존도가 높은 만큼 충격에 취약한 측면이 있다""면서도 ""재정 여력과 정책 대응 능력이 충분해 이를 관리할 수 있다""고 분석했다.유가 상승 지속 기간과 관련해선 특정할 수 없다고 밝혔다. 박 이코노미스트는 ""석유·가스 시설 파괴 등 물리적 충격이 커질 경우 비관적 시나리오(배럴당 평균 150달러)로 전개될 수 있다""며 ""반대로 호르무즈 해협 등 주요 물류 경로가 정상화되면 가격은 비교적 빠르게 안정될 수 있다""고 설명했다.한국 정부의 중동 사태 대응에 대해서는 전반적으로 긍정적인 평가를 내놨다. 석유최고가격제에 대해선 ""현재 상한이 비교적 높은 수준에서 설정돼 있어 재정 부담을 과도하게 키우지 않는 점은 긍정적""이라고 말했다. 다만 유류세 인하나 연료 보조금 등 광범위한 가격 개입은 지양해야 한다고 권고했다.추가경정예산(추경)에 대해서는 ""고유가로 피해를 입은 계층을 지원하기 위한 조치로, 고소득층 지원은 배제하고 소득 하위 70%를 중심으로 설계된 점은 바람직하다""며 ""성장 하방 압력을 완충하는 역할을 할 것""이라고 평가했다.",True,AI 반도체,"ADB는 올해 한국 경제성장률이 1.9%보다 낮아질 가능성을 전망하며, 중동전쟁과 에너지 가격 상승이 성장 하방 압력을 높인다고 분석했다. 반도체 호조는 일부 영향을 상쇄하지만, 유가 장기 상승 우려와 글로벌 불확실성에 대비해야 한다.",AI 반도체,1.0
2026-05-05,"수개월 걸리던 통신 반도체 설계, AI로 하루 만에 끝낸다",정보 없음,https://n.news.naver.com/mnews/article/366/0001161941,"인공지능(AI) 이미지./pixabay국내 연구진이 고성능 통신 반도체 회로 설계에 걸리는 시간을 크게 줄일 수 있는 인공지능(AI) 기술을 개발했다. 전문가가 수주에서 수개월씩 반복하던 설계 작업을 하루 남짓한 시간 안에 처리할 수 있는 기술이다.윤희인 유니스트 전기전자공학과 교수와 송대건 경북대 교수 공동 연구진은 통신 회로인 LC 전압제어 발진기(LC-VCO)를 자동으로 설계하는 AI 모델을 개발했다고 5일 밝혔다. 연구 결과는 전기전자공학자협회(IEEE) 학술지 ‘집적회로 및 시스템 설계자동화(TCAD)’ 온라인판에 지난 4월 공개됐다.LC-VCO는 5G와 같은 고속 통신 시스템에서 주파수를 만들어내는 핵심 반도체 회로다. 통신 신호의 잡음과 전력 소모를 줄이려면 인덕터, 트랜지스터 크기, 배선 구조 등 여러 변수를 정교하게 조합해야 한다.특히 회로도 설계에서는 좋은 성능이 나와도, 이를 실제 칩 안에 배치하는 레이아웃 단계에서 성능이 달라질 수 있다. 배선 폭이나 소자 위치에 따라 의도하지 않은 전기적 영향인 ‘기생 효과’가 생기기 때문이다.연구진의 AI 모델은 회로도 설계와 레이아웃 설계를 따로 다루던 기존 방식과 달리 두 단계를 함께 최적화한다. 회로 설계 단계에서는 강화학습을 활용해 목표 주파수와 성능 조건에 맞는 설계 조합을 찾는다. 강화학습은 AI가 여러 선택을 시도하면서 더 좋은 결과를 내는 방향을 스스로 학습하는 방식이다.레이아웃 단계에서는 경사하강법을 적용했다. 경사하강법은 현재 상태에서 성능이 좋아지는 방향으로 설계 값을 조금씩 조정해 최적점을 찾는 방법이다. 이를 통해 AI는 배선 폭과 간격 등 물리적 설계 요소를 반복적으로 보정한다.설계 과정에서 시간이 많이 걸리는 인덕터 설계에는 딥러닝 기반 예측 기술을 적용했다. 기존에는 반복적인 전자기 시뮬레이션이 필요했지만, 연구진은 이를 몇 ㎳(밀리초) 수준으로 예측해 전체 설계 시간을 단축했다.실험 결과, 기존 자동 설계 방식으로 약 119시간 걸리던 작업을 28.5시간 만에 완료했다. 설계 시간이 76% 이상 줄어든 것이다. 회로 성능을 종합적으로 나타내는 성능 지수(FoM)도 기존 연구보다 우수한 결과를 보였다.공정이 바뀌어도 다시 처음부터 학습할 필요가 적다는 점도 장점이다. 연구진은 전이 학습을 적용해 65㎚(나노미터, 10억분의 1m) 공정에서 학습한 AI가 40㎚나 28㎚ 공정에서도 기존 학습 데이터의 약 10%만 추가로 활용해 설계를 수행할 수 있도록 했다.연구진은 “이번 기술이 5G·6G 통신과 AI 칩에 쓰이는 주파수 생성 회로의 성능을 높이고 설계 비용을 낮추는 데 기여할 것”이라며 “반도체 설계 인력 부족 문제를 완화하고 차세대 공정 전환 속도를 높이는 데도 도움이 될 것”이라고 밝혔다.공동 연구진은 앞으로 LC-VCO뿐 아니라 다양한 아날로그·RF 회로 설계 자동화로 기술을 확장할 계획이다.참고 자료IEEE Transactions on Computer-Aided Design of Integrated Circuits and Systems(2026), DOI: https://doi.org/10.1109/TCAD.2026.3680789",True,AI 반도체,"국내 연구진이 AI 기술로 통신 반도체 회로 설계 시간을 기존 119시간에서 28.5시간으로 단축했으며, 성능도 향상시켰다. 이 기술은 5G·6G 통신과 AI 칩 개발에 기여할 전망이다.",AI 반도체,1.0
2026-05-05,"삼전, 美 AI칩 파운드리 수주…‘TSMC 대안’ 시험대",정보 없음,https://n.news.naver.com/mnews/article/029/0003025130,"ADT-미국 AI 팹리스 계약에 4나노 공정 참여TSMC, 2·3나노 확장 투자 속 유력 대안 주목삼성전자가 4나노 기반 AI 반도체 턴키 프로젝트를 수주하면서 TSMC와의 격차를 줄이기 위한 시험대에 올랐다. 사진은 삼성전자가 미국 텍사스주 테일러시에 건설하고 있는 반도체 공장삼성 파운드리가 미국 AI 팹리스 기업이 주도하는 4나노 공정 기반 인공지능(AI) 반도체 턴키 프로젝트를 수주했다. 이로써 글로벌 1위 파운드리 TSMC와의 격차를 좁힐 수 있는 틈새 기회를 확보했다는 평가가 나온다.매출 규모는 작지만 세계 파운드리 1위 업체인 TSMC의 손이 닿지 않는 틈새 시장을 공략할 수 있는 좋은 기회로 평가되면서 업계에서는 AI칩 파운드리 공급이 수요를 따라잡지 못하는 현 시점을 사실상의 마지막 추격 기회로 보고 있다.5일(현지시간) 대만 디지타임스에 따르면 반도체 디자인하우스인 에이디테크놀로지(ADTechnology)는 미국 기반 AI 팹리스 기업과 약 400억원 규모의 일괄수주(턴키) 계약을 체결한 것으로 나타났다.이번 계약은 미국 AI 팹리스가 설계·개발을 주도하고, 에이디테크놀로지가 이를 기반으로 삼성 파운드리 4나노 공정을 활용해 생산까지 연계하는 구조다. ADT는 반도체 설계부터 생산 관리, 공급망 조율까지 수행하는 디자인하우스 기반 턴키 솔루션 업체다.해당 프로젝트는 AI 데이터센터용 고성능컴퓨팅(HPC) 시스템반도체(SoC) 칩렛을 중심으로 진행되는 것으로 알려졌다. 팹리스와 설계 서비스 업체, 파운드리가 결합된 3자 협력 모델이다.이번 구조에서 미국 AI 팹리스 기업이 전체 칩 설계와 사양을 결정하고, ADT가 이를 기반으로 개발 및 생산 관리를 맡아 삼성 파운드리에 제조를 의뢰하는 방식이다.삼성 파운드리는 최근 비수기 영향으로 1분기 실적이 감소한 가운데에서도 HPC 중심의 수주 확대 전략을 이어가고 있다. 4나노 공정은 수율이 약 80% 수준에 근접한 것으로 알려지며, 안정적인 양산 능력을 기반으로 고객 확대 가능성이 점쳐지고 있다.최근 글로벌 파운드리 시장은 AI 반도체 수요 폭증에 대응한 생산능력 경쟁이 더욱 치열해지는 모습이다. 글로벌 파운드리 1위 기업인 TSMC는 AI 및 HPC 반도체 공급 부족에 대응하기 위해 중단됐던 룽탄 과학단지 3기 확장 건설 프로젝트를 재개한 것으로 알려졌다.해당 부지에는 약 23조~28조원 규모 투자가 투입돼 차세대 옹스트롬(0.1 나노미터)급 반도체 생산 라인이 구축될 예정이다.또 TSMC는 연말까지 2나노와 3나노 공정 웨이퍼 생산능력을 약 20% 확대할 계획인 것으로 전해졌다. 업계에서는 AI 반도체 수요 급증으로 주요 고객사의 생산 슬롯 확보 경쟁이 심화되고 있으며, TSMC의 공격적 증설이 시장 지배력을 더욱 강화하는 요인으로 작용할 것으로 보고 있다.시장조사업체 카운터포인트리서치에 따르면 지난해 말 기준 TSMC는 전 세계 파운드리 시장에서 약 70% 안팎의 점유율을 차지하고 있으며, 삼성 파운드리는 약 7~8% 수준에 머물고 있다.삼성전자는 지난달 말 진행한 1분기 실적발표 콘퍼런스콜을 통해 ""파운드리는 여러 AI HPC 대형 고객사와 2나노 협력 논의를 활발히 진행하고 있다""며 ""일부 고객과는 곧 가시적 성과를 확보할 것으로 기대한다""고 밝혔다.이어 ""선단 공정 라인 가동률이 최고 수준에 도달했다""며 ""4나노 공정으로 만든 6세대 'HBM4'의 베이스다이 공급이 증가해 실적 개선이 전망된다""고 덧붙였다.",True,파운드리,"삼성전자는 미국 AI 팹리스와 4나노 AI 반도체 턴키 계약을 체결하며 TSMC와의 격차를 좁히려 하고 있다. 이 프로젝트는 AI HPC용 칩 설계와 생산을 연계하며, 삼성은 4나노 기술로 고객 확대를 추진 중이다. TSMC는 2·3나노 확장에 집중하며 시장 지배력을 강화하고 있다.",AI 반도체,2.0
